"Project/Program Name","Phone Numbers","Email/Website","Coverage Area"
"Prime Minister Agriculture Modernization Project (PMAMP), Singha Durbar, Kathmandu","01-4211956, 9851052976, 9851052977","http://www.pmamp.gov.np","All districts"
"Agriculture Development Strategy Program (ASDP), Pulchowk","01-5537823","mailto:info@asdp.gov.np","All districts in all provinces"
"Rural Community Infrastructure Project (RCIP), Dillibazar, Kathmandu","01-4416522","http://www.aciu.rjkip.gov.np","Kailali"
"Food Security and Nutrition Enhancement Project-2 (FANSEP-2), Hariharbhawan, Lalitpur","01-5520742, 5520115","mailto:fansepsaptari@gmail.com","9 districts: Siraha, Saptari, Sunsari, Dhanusha, Mahottari, Sarlahi, Rautahat, Bara, Parsa"
"High Mountain Fruits and Vegetables Production Project (NAFHA), Hariharbhawan, Lalitpur","01-5520191, 9851060764, 9851053196","mailto:cpmu.nafha@gmail.com","Koshi province, Ilam, Panchthar, Sankhuwasabha, Taplejung, Bhojpur, Solukhumbu, Okhaldhunga, Tehrathum, Udayapur, Sindhupalchok, Dolakha, Ramechhap, Khotang, Lamjung, Gorkha, Baglung, Myagdi, Mustang, Dolpa, Jumla, Mugu, Humla"
"Rural Enterprises and Economic Development Project (REED), Hariharbhawan, Lalitpur","01-5520702, 5521191, 9851105745, 9841296784","mailto:reedcobutwal145@gmail.com","1: Middle North Terai (Koshi, Madhesh, Bagmati, Gandaki, Lumbini, Karnali, Sudurpashchim). 2: Hills - Kanchanpur, Dadeldhura (Far West)."
"Rural Enterprises and Economic Development Project (REED), Dadeldhura Office","096-420107, 9800982710, 9800970901","mailto:reed.dadeldhura@gmail.com","Dadeldhura"
"High Value Agriculture Project (HVAP), Khumaltar","01-5523906","mailto:rhvapnepal.pco@gmail.com","1: Lumbini & Sudurpashchim Provinces (7 districts), 2: Koshi Province (2 districts), 3: Sudurpashchim (4 districts) and Karnali (1 district)"